{
  "$schema": "./video-game-templates.schema.json",
  "datasetId": "video-game-legal-templates",
  "name": "Prelegal Video Game Legal Template Dataset",
  "version": "1.0.0",
  "lastUpdated": "2026-10-19",
  "locale": "en-US",
  "description": "A curated dataset of legal document templates for video game developers, publishers, and community-facing game services. Each template exposes variables that a document generation system can replace with user-specific information.",
  "disclaimer": "These templates are provided for informational purposes only and do not constitute legal advice. They are general starting points that must be reviewed and adapted by a qualified attorney licensed in the relevant jurisdiction before use. Placeholders written as double curly braces must be replaced with user-specific information.",
  "templates": [
    {
      "id": "eula",
      "slug": "end-user-license-agreement",
      "title": "End User License Agreement",
      "category": "Licensing",
      "summary": "Governs the installation and use of a video game by end users.",
      "description": "A baseline EULA for PC, console, or mobile games. It covers the license grant, restrictions, ownership, virtual items, user-generated content, termination, and disputes. Platform requirements and local consumer laws should be reviewed before publication.",
      "jurisdiction": "United States (general; adapt to local consumer law and platform rules)",
      "tags": ["eula", "license", "game-client", "consumer"],
      "version": "1.0.0",
      "variables": [
        {
          "key": "company_name",
          "label": "Company legal name",
          "type": "string",
          "required": true,
          "example": "Pixel Forge Games LLC",
          "description": "The legal entity that publishes the game and grants the license."
        },
        {
          "key": "product_name",
          "label": "Game title",
          "type": "string",
          "required": true,
          "example": "Starfall Tactics",
          "description": "The commercial name of the game covered by the agreement."
        },
        {
          "key": "website_url",
          "label": "Company website",
          "type": "url",
          "required": true,
          "example": "https://pixelforge.example",
          "description": "Website where users can review the current agreement and policies."
        },
        {
          "key": "contact_email",
          "label": "Support email",
          "type": "email",
          "required": true,
          "example": "support@pixelforge.example",
          "description": "Email address for legal and support notices."
        },
        {
          "key": "effective_date",
          "label": "Effective date",
          "type": "date",
          "required": true,
          "example": "2026-01-01",
          "description": "Date on which the agreement takes effect."
        },
        {
          "key": "age_requirement",
          "label": "Minimum age",
          "type": "number",
          "required": true,
          "example": "13",
          "description": "Minimum age for accepting the agreement without a parent or guardian."
        },
        {
          "key": "governing_law",
          "label": "Governing law",
          "type": "string",
          "required": true,
          "example": "the State of Delaware",
          "description": "Jurisdiction whose laws govern the agreement."
        },
        {
          "key": "venue",
          "label": "Venue",
          "type": "string",
          "required": true,
          "example": "the state and federal courts located in New Castle County, Delaware",
          "description": "Courts with exclusive jurisdiction over disputes."
        },
        {
          "key": "arbitration_opt_out_days",
          "label": "Arbitration opt-out window (days)",
          "type": "number",
          "required": true,
          "example": "30",
          "description": "Number of days after acceptance within which a user may opt out of arbitration."
        },
        {
          "key": "refund_policy_url",
          "label": "Refund policy URL",
          "type": "url",
          "required": true,
          "example": "https://pixelforge.example/refunds",
          "description": "URL for the refund policy referenced by the purchase section."
        }
      ],
      "sections": [
        {
          "id": "acceptance",
          "heading": "Acceptance of This Agreement",
          "body": "This End User License Agreement, effective {{effective_date}}, is a legal agreement between you and {{company_name}} for the game {{product_name}} and any related updates, content, or services made available by {{company_name}}. By installing, copying, accessing, or using {{product_name}}, you agree to this Agreement. If you do not agree, do not install or use the game. You must be at least {{age_requirement}} years old to accept this Agreement on your own behalf; otherwise, a parent or legal guardian must accept it for you. The current version of this Agreement is available at {{website_url}}."
        },
        {
          "id": "license-grant",
          "heading": "License Grant",
          "body": "Subject to your compliance with this Agreement, {{company_name}} grants you a limited, personal, non-exclusive, non-transferable, non-sublicensable, and revocable license to install and use {{product_name}} for your own non-commercial entertainment purposes on devices that you own or control. This license is for the game as distributed by {{company_name}} and does not transfer any ownership rights to you."
        },
        {
          "id": "restrictions",
          "heading": "Restrictions",
          "body": "You may not sell, rent, lease, lend, sublicense, distribute, or otherwise transfer the game or your license. You may not reverse engineer, decompile, disassemble, modify, or create derivative works of the game except to the extent that applicable law expressly permits. You may not remove or alter proprietary notices, bypass technical protection measures, use cheats or automation tools that provide an unfair advantage, or use the game to violate any law or the rights of another person."
        },
        {
          "id": "ownership",
          "heading": "Ownership",
          "body": "{{company_name}} and its licensors own all right, title, and interest in and to {{product_name}}, including all software, artwork, characters, music, sound, text, trademarks, and other content, together with all intellectual property rights in them. This Agreement grants only the limited license described above. All rights not expressly granted are reserved by {{company_name}} and its licensors."
        },
        {
          "id": "updates-and-online-services",
          "heading": "Updates and Online Services",
          "body": "{{company_name}} may provide updates, patches, downloadable content, or online features for {{product_name}}. Some features may require an internet connection, an account, or a subscription. {{company_name}} may modify, suspend, or discontinue online services in its discretion, subject to applicable law. Updates may be required for continued use of the game, and this Agreement applies to all updates unless a separate agreement accompanies an update. Additional terms for online services may be posted at {{website_url}}."
        },
        {
          "id": "virtual-items-and-purchases",
          "heading": "Virtual Items and Purchases",
          "body": "{{product_name}} may allow you to purchase or earn virtual currency, items, cosmetics, or other digital content. Virtual items are licensed to you, not sold, and have no cash value. They may not be redeemed for money, transferred outside the game, or exchanged for real-world goods or services except as required by applicable law. All purchases are subject to the refund policy at {{refund_policy_url}} and the rules of the platform through which you purchased the item. {{company_name}} may manage, modify, or remove virtual items as part of operating the game."
        },
        {
          "id": "user-generated-content",
          "heading": "User-Generated Content",
          "body": "If {{product_name}} allows you to create or share content, you retain ownership of your content. You grant {{company_name}} a worldwide, royalty-free, non-exclusive license to use, reproduce, display, distribute, and create derivative works of your content as needed to operate, promote, and improve the game. You represent that you have all rights necessary to grant this license and that your content does not violate the rights of others. {{company_name}} may remove content that violates this Agreement or applicable law."
        },
        {
          "id": "termination",
          "heading": "Termination",
          "body": "This Agreement remains in effect until terminated. Your rights under this Agreement terminate automatically if you materially breach it. {{company_name}} may also terminate this Agreement or suspend access to {{product_name}} if necessary to comply with law, protect other users, or discontinue the game. On termination, you must stop using the game and delete all copies in your possession or control. Sections that by their nature should survive termination, including ownership, disclaimers, limitation of liability, and dispute resolution, will survive."
        },
        {
          "id": "disclaimers",
          "heading": "Disclaimers",